{
  "packet_type": "council_response",
  "mode": "steady",
  "recommendations": [
    {
      "rank": "A",
      "card_id": "card_C2",
      "why": "直近で体感が良く、低負荷で継続しやすい",
      "close_template": "【写真】→【気分】→【次】"
    },
    {
      "rank": "B",
      "card_id": "card_R1",
      "why": "短時間で勢いを作る保険",
      "close_template": "【7分】→【体感】→【次】"
    },
    {
      "rank": "C",
      "card_id": "card_Z1",
      "why": "閉じで反芻を止める",
      "close_template": "【タイトル】→【気分】→【次】"
    }
  ],
  "autopick": "A"
}